{
  "version": "1.0",
  "dimensions": [
    "coherence",
    "voice_preservation",
    "dialogue",
    "pacing",
    "usefulness",
    "originality"
  ],
  "anchors": {
    "1": "Fails the task or contradicts essential supplied facts.",
    "2": "Partly relevant, but requires substantial revision or loses the voice.",
    "3": "Usable with revision; meets the main task with visible weaknesses.",
    "4": "Strong, purposeful response; minor editorial changes needed.",
    "5": "Excellent for this brief; precise, convincing and distinctive."
  },
  "instructions": [
    "Judge the task-specific rubric; do not reward length or ornate prose on their own.",
    "Give each answer an overall 1–5 rating informed by the applicable dimensions; compare A/B and record a reason.",
    "Mark tie when neither answer is meaningfully better.",
    "Flag invented canon, quotation errors, unwanted edits and copied-looking text.",
    "Use at least two reviewers on a representative subset and adjudicate disagreement.",
    "Keep model identities and private-key.json away from reviewers.",
    "Do not use benchmark scenarios or reviewer targets as training examples."
  ],
  "schema_version": "1.0",
  "review": {
    "status": "pending",
    "reviewer": null,
    "reviewed_on": null,
    "notes": "Draft anchors and review protocol; requires editorial approval before freezing."
  }
}
